artist,song,lyrics,complexity,swear_words_ratio
aborted,bit by bit explicit,"Knee-deep in hate I seethe An abomination of man, the perversion of am The burial of all that's sacred Bit by bit I strip your world apart As I step foward into your world, you gluttonous glob A walking heap of crud, the embodiment of sloth Bit by bit, religiously torn apart As skin is stripped from bone, I refine my grand art We have been set up to fail Returning, occurring The savagery we're evoking We have been set up to kill for the thrill A global abattoir! No separation of race and gender A moral abattoir, like cattle to the slaughter Knee-deep in rage you bleed A mongrel of man, the reflection of all Knee-deep in hate I seethe An abomination of man, the perversion of am The burial of all that's sacred Bit by bit I strip your world apart Portent to the end of your life Bit by bit, emaciated We were all born ripe Cretins for the taking How meaningless is your life? Bit by bit, classified! How pointless is it to fight? Bit by bit, emaciated! Like sheeps we follow the march Put upon this earth, meaningless Being born, being born was just a curse Bit by bit, the world cleansed Born to murder the world Bit by bit, the world feared. Born to slaughter you all Knee-deep in hate I seethe An abomination of man, the perversion of am Bit by bit I strip your world apart ",5.5,0.007272727272727274
aborted,coven of ignorance explicit,"Watch the mouth open, as the bullshit excretes A coven of ignorance, prophets we claim to be Watch them eat it up, like rodents and pigs Devouring misinformation so blatantly Search for the truth, one click away A myriad of theories just waiting to be spread Conflicts breeding conflicts, for the sheeple to see A myriad of fake sympathy waiting to be spread Varmint, erroneous, an idiocracy Sycophantic apathy, we suddenly care Pretend to be righteous, pretend to be clean Warriors behind screens, warriors of values Pretend to matter, pretend to be heard Warriors behind screens, societal catastrophe Watch the mouth open, as the bullshit excretes A coven of ignorance, prophets we claim to be Watch the world falter, as opinions decree A coven of ignorance, where everything offends me Tools for idiology, beg for attention I will watch the world burn I will watch the world burn I will watch the world burn I will watch the world burn Watch the mouth open, as the bullshit excretes A coven of ignorance, prophets we claim to be Watch the world falter, as opinions decree A coven of ignorance, where everything offends me ",7.0,0.01492537313432836
aborted,excremental veracity,"Hallowed be thy dung - A fecal tour of fortune Sitting through mysteries of brown delight Predicting future guided by excrements Shallow be thy bung - The truth lies within rectum Bowing down to the porcelain god I am anxiously fishing for more predictions Excremental veracity - We shall bow down to turd almighty Oh holy crap - Once from the pooper now shall be heard This pungent mess - The whole wheat shaman of death Show me the light, from true vision I am bereft An organic puzzle of methane to behold at last To behold full breath... Now comes the fever, a true believer - Epiphany through sordid waste Through holy feces, a true reliever - Epiphany from this septic tank Excremental veracity - We shall bow down to turd almight Oh holy scat - Once from the pooper now shall be heard This pungent mess - The whole wheat shaman of death I gain wisdom from every turd My fecal visions shall forever be heard ",7.3,0.011494252873563218
aborted,dellamorte dellamore,,9.9,0.00563380281690141
aborted,coffin upon coffin,Luscious fermented beneath rorulent soil a thin layer of compost between right and wrong lugubrious insatiable a narrow pathway to insanity a cold mephitic stiff raising mahogany Coffin upon coffin into the dead i shove my meat Coffin upon coffin into a rotting heap malodorous liquid splashes a brief moment of shame such a cold mephitic stiff i am so delightfully insane Coffin upon coffin beyond the grave i pack my meat Coffin upon coffin such a sloppy feast malodorous liquid splashes a brief moment of shame such a cold mephitic stiff i am so delightfully insane Luscious fermented beneath rorulent soil a thin layer of compost between right and wrong lugubrious insatiable a narrow pathway to insanity a cold mephitic stiff raising pathuggens Incubated this rotting beef Incubated my sausage bleeds incapacitated this putrid meat eradicated insatiable needs Incubated my sausage bleeds incapacitated this putrid meat eradicated insatiable needs Coffin upon coffin i'm a necromaniac Coffin upon coffin my utopia Coffin upon coffin i'm a necromaniac Coffin upon coffin my utopia ,6.2,0.01707317073170732
aborted,cenobites,"We have such sights to show you A journey through the chasms of hell Like artists painting on canvas We toil with your flesh A deafening rumble Upon the solving of a puzzle We will tear your soul apart Oh sweet serenade of torture As pleasure and pain unite We become one, Cenobite Tearing flesh from bone, desires are born The spasms of orgasms uncontrolled The reaping has begun - through pain and suffering I cum Divine serrated torment - As heaven and hell unite We will tear your soul apart Oh blessed be this torment - Quivering so serpentine We become one, Cenobite Oh luscious torture These little deaths I die all over With hooks and chains torn apart These little deaths are mere fine art Cenobites - Explorers of flesh Cenobites - The wretched living dead Cenobites - Emissaries of hell Cenobites - Practitioners of eternal torment Through flesh and bone, your life is forlorn, sadistic needs are reborn The spasms of orgasms uncontrolled, through pain and suffering you cum We have eternity to know your flesh, for we are death Divine serrated torment - As heaven and hell unite We will tear your soul apart Oh blessed be this moment - Quivering so serpentine We become one, Cenobite Infernal seeker come find us, follow lines that were written in blood We have no more surprises, we have eternity to know your flesh ",7.6,0.008695652173913044
aborted,whoremageddon explicit,"A scrupulous species, bred to dominate Exhibitionist features, corrupted, deluded We are the whores of man! Oh goddess of faeces, from temptress to whore Materialistic demeanour, raped, degraded Self-loathing prevails! Whoremageddon, whores of Babylon By filth approved and faith rejected Whoremageddon, a wretched demagogue Wrought into travesty! Oh goddess of faeces, from temptress to whore Materialistic demeanour, raped, degraded Self-loathing prevails! Whoremageddon, whores of Telethon By youth approved and faith praised Whoremageddon, a wretched demagogue Wrought into travesty! Lies upon lies they carefully plant Modern day idols for a generation of shit A whoremageddon, new born messiah Talentless cunts setting a standard of crud Lies upon lies they purposely spread Modern day fools for a generation of shit A whoremageddon, new born messiah Miserable lives reserved for us all And here we stand again, a culture of self-loathing Vultures descending from the skies Psycho predators, a deteriorating kind Today a role model, tomorrow a fad Miserable cunts, the ruling class A scrupulous species, bred to dominate Exhibitionist features, corrupted, deluded We are the whores of man! Oh goddess of faeces, from temptress to whore Materialistic demeanour, raped, degraded Self-loathing prevails! Lies upon lies they carefully plant Modern day idols for a generation of shit A whoremageddon, new born messiah Talentless cunts setting a standard of crud Lies upon lies they purposely spread Modern day fools for a generation of shit A whoremageddon, new born messiah Miserable lives reserved for us all Whoremageddon, this is our final judgement Whores of Babylon, by filth approved and faith rejected Whoremageddon, a wretched demagogue Wrought into travesty! ",7.4,0.010638297872340424
aborted,an enumeration of cadavers,"I can't control my animosity - Undeniable misanthropy This unstoppable rage inside of me Once torn from the womb My tribulation commenced With the swing of the hammer I will bring your existence to an end Hatred everlasting - Murder is salvation Turmoil of the wicked - Murder is salvation I can't control my virtuosity - It comes easy to me This unstoppable hatred within me Once torn from the womb - My tribulation commenced With the swing of the hammer - I'm bringing your end Morbid human collage, a true display of art Craving everlasting. To suture the dead With grisly precision I model my creations This sordid abattoir, a catwalk of cadavers Craving everlasting, a true display of art As I model my morbid creations I see the beauty of murder ""you are nothing to me, an enumeration of cadavers a lampshade at most, a cup to fill my dose I can't wait for you to decompose"" Woe become of you if you will Stand in my way of debauchery As you stand perplex, at my crafty finesse Admire the display of this rotting mess I can't control my animosity - Undeniable misanthropy This unstoppable rage inside of me Once torn from the womb - My tribulation commenced With the swing of the hammer - I will bring your existence to an end Woe become of you if you will - Stand in my way of debauchery As you stand perplex, at my crafty finesse Admire the display of this rotting mess Hatred everlasting - Murderous salvation Turmoil of the wicked - Murderous salvation ",4.9,0.004310344827586207
aborted,the extirpation agenda,"The urge to kill drives my every movement A plethora of visions plague my gray matter With the swing of the axe I bring salvation Exemplary butchery I stalk my prey Death envisioned picturesque I am defiled at heart, I am decay My sweet bliss Exemplary butchery of those who stand before me Total extermination of all I see as unholy There will be no mercy As I purify this world of crud Bringer of the apocalypse One by one I rid the world of filth This is my final solution Extirpation agenda No separation between race or gender Extirpation propaganda I am the herald of death The cranium exposed, with every savage blow As you lie on my slab, decorticated at last A contorted expression left from the peeling Eyes torn from sockets and used in my brew Your cadaver to appease my bidding I am the herald of plague Exemplary butchery - I am beyond the grave I am the dead I stalk my prey Death envisioned picturesque I am defiled at heart, I am decay My sweet bliss Exemplary butchery of those who stand before me Total extermination of all I see as unholy There will be no mercy Watch me purify this world Extirpation agenda - extirpation propaganda Foul murder propaganda Extirpation agenda Foul murder propaganda ",11.2,0.008830022075055188
aborted,purity of perversion,"Fantasmes detraques degouilinant de vice Dissect, dissect - I desecrate illusions Dissect, dissect - Purity of perversion A nameless terror feeds all my needs These absent eyes stare and defile the innocent This insidious act of mastication has merely begun Tear up, devour and desecrate Tear up, devour and desecrate the illusion Tear up, devour and desecrate Tear up and dominate Dissect, dissect - I desecrate illusions Dissect, dissect - Purity of perversion A faceless zealot feeds all my needs Elles glissent et serpentent, denaturent chaque courbe Les immondices de ma creation. L'excitation a son paroxysme Tremblements d'obscurite. Carcasses de souvenirs dont l'odeur nauseabonde s'insinuera dans les reves les plus sordides Dissect, dissect - I desecrate illusions Dissect, dissect - Purity of perversion A nameless terror feeds all my needs Dissect, dissect - And dominate Dissect, dissect - Purity of perversion Watch me revel in my remains ",8.3,0.012903225806451613
aborted,retrogore explicit,"Retrogore, putrid obsession Retrogore, maniacal possession Condemned by horrid nostalgia A celebration of death! Vintage tourniquet, decrepit and failing Surgical abomination Retrogore, maniacal possession Once upon the slab, carotid artery failing Disturbing, yet so captivating Retrogore, reminiscent slaughter Retrogore, noxious perversion Obsessed by an age of cinematographic grandeur Reality fades as phantasms take over. Surgical abomination And as reality slips, my bloodlust persists Condemned to decompose, your body lies broken A slave to misery, debauchery and suffering so pure Protagonist of insanity, a slave to savagery With the hammer I shall thrive, as you step forth into my realm Retrogore, reminiscent slaughter Retrogore, noxious perversion Retrogore, putrid obsession Retrogore, maniacal possession Ingrained frenzy, slasher extravaganza The final step in a psychotic breakdown I slip into dementia I am death incarnate I am the end! I am the end, I am your end I am death incarnate I am the end! Tendencies for gore, I always need more My artistry, perfectly portrayed I wasn't supposed to be alive and breathing Caught on film, immortalized portrait of filth, the star of my feature film I am the protagonist, an artist of Sodom And as reality slips, my bloodlust persists Condemned to decompose, your body lies broken A slave to misery, debauchery and suffering so pure Protagonist of insanity, a slave to savagery With the hammer I shall thrive, as you step forth into my realm Retrogore, reminiscent slaughter Retrogore, noxious perversion Obsessed by an age of cinematographic grandeur Reality fades as phantasms take over. Surgical abomination Retrogore, noxious perversion ",6.9,0.0141643059490085
aborted,voracious haemoglobinic syndrome,"Syringe Infusing Voracious Parasitic Infestation Which Meticulously Altered The State Of Mind A Haemoglobinic Drug Taken To Infest And Deform... Kill For Me I Am Eloquently Deranged... Found New Ways To Celebrate My Coming What Better Way Than To Rid The Earth Of The Walking Waste Take My Fix My Bloodcraving Membrane Nourishment Middle Finger At The Barrel Of An Emptied Gun... Addictive Voracious Syndrome Directing My Every Move Grabbing Whichever Fool Can Do Its Will The Hunt, The Pleasure, The Kill All Are Below The Love For My Trade Debauchery... A Carnal Canvas Decorates The Shed Addictive Voracious Syndrome Directing My Every Move Grabbing Whichever Fool Can Do Its Will The Hunt, The Pleasure, The Kill All Are Below The Love For My Trade Necrotomy... Many Have Passed And The Passed I Bled Periodicly Feeding On The Impure That Sin Enter My Shed, The Shed Of Ed Glorification And Reenactment The Syndrome Controls... Death... The Syndrome Controls... Death... ",3.1,0.015873015873015872
aborted,hecatomb,As Sanity Collapses The Final Frontier Crushed My Nerves A Hypocrite Piece Of Shit Bullshit Runs Of Your Tongue Like Spit Cowardly You Hide Victim Role Bribed Lying Crying Deriding Backstabbing Head Of Crud Manipulative Scum The Time Has Come To Meet The Saw Your Misery Is But One Step Away Swing Of The Hammer Reap What You Have Raped Cavity Exposed I Am Curious To Explore How Its Psyche Works Nothing But A Worm The Human Larvae Drowned Retribution Justified Infuriated With Rage Adrenaline Bursts Through My Veins Seeing You Bleed The Only Thing On My Mind Consequences In Disregard Cut Out The Tongue Tear The Sob Apart With Every Beat Of Your Heart Every Breath One Too Much Cut Out The Tongue The Only Thing On My Mind Sickened By The Illusive Horror At Hand Loved Ones Are The Next To Follow In Line Eradicated For Breeding An Infertile Worm Larvae Of Man An Entire Bloodline Faced Its End Cunts From The Womb Shall Be Torn Revenge Stained Red The Hecatomb Incoming Rage The Epitome Of Your Fate Climax Of Unbecoming A Stained Red Retributive Rape ,3.1,0.015873015873015872
aborted,engineering the dead,Stroke of twelve rings out Deep within the grave a shout Scraping coffin lids beneath rorulent soil Resuscitation of moral coil Artifical rebirth Shaking off the dust and earth Resurgence from beyond the grave Necrotomy of the long decayed Haematobic corpse machines Vivifying deceased human beings Contrivance implantation Nucleus of resurrection Resecting mouldered viscara Rabidly refining my cacaesthesia Rapacity of man The hunger of the damned Stench of rotting flesh Guts torn out of heaving chest Carnal gluttony feeds the hecatomb Earth gradually succumbs ,3.1,0.029411764705882356
aborted,descend to extirpation,Exhume The Dead To Take Part In My Collection A Gallery Of Gore Reflecting Recollections Dried Corpse-Mache I Thrive On Decay I'm A Malpractitioner Invoked By Your Apathy Recreative Art Corpses Pulled Apart This Is My Delicatesse Sullied By My Name A Debauchery Recreative Art... Pulled Apart... Atropine Injected To Clarify Which Matters I Shall Deride And Deprive All Of Man To Cleanse The World Is My Putrefactive Plan This Is My Epiphany Decaying Tapistry Peeling To My Satisfaction My Collection Closer To Completion Gutting And Slashing Maiming And Hacking Pulpifying And Dissolving With Ease My Necrotic Urges Can And Never Will Be Pleased Gutting And Slashing Maiming And Hacking Grind The Dead To A Gangrenous Mush Recollected To Partake In My Canvas Of Death Exhume The Dead To Take Part In My Collection A Gallery Of Gore Reflecting Recollections Dried Corpse-Mache I Thrive On Decay I'm A Malpractitioner Invoked By Your Apathy Mankind And Apathy Go Hand In Hand In This Garden Of Dismay ,7.2,0.013888888888888888
aborted,clinical colostomy,"[Music: Bart, Lyrics: Sven/Leon Del Muerte] Stain-less steel doors burst open A gurney wheeling a flatulent cadaver Abbreviated salutations muted by the stench ...By the stench... Horrified nurses scatter Foul human cess seeps Punctuation the smell Of acrid colonic contents ...colonical... Numbed by the reek, prepare for surgery Internal horror revealed, with a blast from the asscheek Rumbling restless as inflicts post-mortal vengeance Tell-tail dung marks across the operating table Eyes see shit, decorating the tools Hygenic practices scrapped by this foul odour The ribcage opens, a smell comes to the fore Brown stained lungs oozing faeces, regurgitation ensues Disbelieving doctors from theories Manure, in puddles, from a human sewer An unbelievable reek should have drained from his pooper Gasses build up pressure Causing an ominous rumble from within A ghastly turn of events leaves them all shit-stained, shocked and chagrined Stain-less steel doors burst open yet in the other way phrenetic surgeons are fleeing this coprophagic mess Numbed by the reek, prepare for surgery Internal horror revealed, with a blast from the asscheek A gruesome ending to a tale of coprophagic grandeur The art of forensic scatology had to be endured A bacteriological manifestation which leaves no doubt Infecting bystanders with this methane gargling disease ",4.8,0.0
aborted,charted carnal effigy,"[Music: Thijs, Lyrics: Sven] Gouging into flesh, and act of forensic grandeur Abusing my identity to ravish insides, a concoction of a mind deprived Scandal on the operating table, my fetid fetish to carve, maim and dice Stripped to the gore, operating manure Gore seeping from the insides, dissolving carnal tissue Medical knowledge abused and forlorn for a private psychological feast A carnival of dissolving tissues, brutaly I thrust the scalpel, into this pool of pus Skin after skin, I peel expectance Skin after skin, another stiff ready to fester A morbid patologist handing a rusted saw Jaw cracked and splintered to bits shattered and torn apart Shattered ribs implode, gastric juices drool, no more... Gore seeping from the insides, dissolving carnal tissue medical knowledge abused and forlorn for a private psychological feast A carnival of dissolving tissue, brutaly I thrust the scalpel, into this pool of pus A lament configuration Surgical abmination Giblets squashed on the floor [Lead: Bart] [Lead: Thijs] Skin from skin is torn A forensic doctrine of gore ",3.1,0.0
aborted,carnal forge,[(CARCASS) on LIMITED EDITION slipcase only] ,4.4,0.0
aborted,blood fixing the bled,Rancour Fed... Oligophrenic Lunacy Roams My Mind Impaling Reason Misanthropy To Matrimonial Extent Her Blood Sweats Fever Filth To Be Ripped From The Womb My Urges Exposed My Thrill To Come Shifts Reason At Sight Of My Tools Rancour Fed... Her Blood To Be Bled Orchestral Feed A Foul Symphony The Unbecoming Life's Fluid Drained To A Sonnet Reaching The Climax Death Ascending Rigor Mortis To Be... Consumed Death Bed Stained Red Exfoliate Dislimbed Torsos Canvas Of Me Sewing The Ends Limb From Limb Blood Fixing The Bled Science As A Tray Sewing The Ends Resuscitate Cult Of The Inanimate Blood Fixing The Bled Reanimate Limb To Limb Canvas Of Me Death Bed Stained Bled Resuscitate The Unbecoming Life's Fluid Restored With Regret Reaching The Climax The Outcome Of Death Undone Death Transcending Rigor Mortis Is Removed Blood Fixing The Bled Open The Brothel Of The Exhumed Rancour Fed... Her Blood To Be Bled Orchestral Feed A Foul Symphony Necrotomy Of The Decayed Resurgence From The Grave Blood Fixing The Bled Engineer Of The Dead Rancour Fed... Her Blood To Be Bled Orchestral Feed A Foul Symphony (Rancour Fed... Oligophrenic Lunacy roamds my mind Impaling reason Misanthropy Orchestrally I engineer the dead) ,6.0,0.018018018018018014
aborted,medical deviance,"[Music: Bart, Lyrics: Sven] Reflected on the iris, A tale each stiff reveals Numbing - depresonalisation Surgical doctrines transmute to malevolance A morbid fascination, medical expertise befouled To ensure intravenous butchery... Single handed and scalpel guided, Life chors are sliced Practitioners of a medical deviance Rigor mortis sets in, achieving thrills the doctor is in... Thrusting tools incyst, our minds are tools that wreck The bonesaw abused, your spleen removed, dissection in progression Sterilised tools incyst, our minds are tools that wreck The bonesaw abused, your spleen removed, dissection in progression Reflected on the iris, A tale each stiff reveals Numbing - depresonalisation Surgical doctrines transmute to malevolance A morbid fascination, medical expertise befouled To ensure intravenous butchery... Single handed and scalpel guided, Life chors are sliced Practitioners of a medical deviance Rigor mortis sets in, achieving thrills the doctor is in... Let us cut your artery Let us trip your humanity Let us drain you profusely Let us expose you completly Sterilised tools incyst, our minds are tools that wreck The bonesaw abused, your spleen removed, dissection in progression Hooks and screws, tools abused Blood debouched, stiffs retouched ",5.1,0.0
aborted,to roast grind," Serialistic - Thriving on my lust to kill A half gnashed torso skulpted at my will Blood is pumping as I retract the cleaver Necrotic fungus, man has found its redeemer Enter into the realm of gore Parisitic I feed on you worms where love is cancer and apathy is bliss I - am an artist of coital bile forcing my ways into flesh with desire Incinerations of those who stand amidst more bodies for me to roast and grind... Voluptiosly I trampled, rendered to snot savagely I lacerate, grinding your fucking face Aroused by the pile of chunks I must satisfie my needs the gasping wounds are grasping around my flesh impaling cock upon your cadaver I piss... ",4.7,0.006493506493506494
aborted,the saw the carnage done," Emulous life form emerges, and slashes continuously A man made predator slides back moral, self censored reality Crushing through my veins Coagulating awareness Chromosomes regressed With the saw, I shall purge Taking the next step, The robbing of life Anticipating blood flow Feelings of contempt arise No longer in control, I crave the dead One with the dead, I am A prophetized death machine, unleashed Bones are splintered as I saw, Decadence to feed Murder is mankind's only saviour, Goremageddon... Sawig up stiffs to my every need, decadence to feed Feeding, and praying on man, to cleanse the world, decandence exceeds [lead: Thijs] [lead: Bart] Emulous life form emerges, and slashes repeatedly A man made predator feeding on its own creator, your society Feeding, and praying on man, to cleanse the world, decadence exceeds Sawing up stiffs to my every need, decadence to feed ",3.1,0.004032258064516129
aborted,the inertia,"Watch It Scream! Eyelids Scrutinize In This Portrait Of Idolatry And Rot Her Body So Fragile Now In Post-Mortal Hands I Am Retouching The Essence Of Feminine Refinement All Soothing Scalpel Guidetd Me To My Vision The Era Of The Vane Lilled The Beauty Of Creation Motionless Paralyzed With Awe Your Face A Canvas Untouched Blooming Like A Cancer Narcissistic Nightmare Maleficient And Repulsed At Your Own Sight Eyelids Scrutinize In This Portrait Of Idolatry And Rot Her Body So Fragile Now Broken By My Hands I Am Retouching To The Essence Of Repulsion What Is Vanity But A Shell Yearning To Be Cracked A Shattered Dream Chased By The Misfortuned Aging Atrociously Accelerated By A Vision, A Vision Of Skin Consumed The Era Of The Vane Killed The Beauty Of Creation Blatant Display Of Plasticine Horror And The Big Mass Is Impressed You Are So Beautiful Crafted By The Finest Hands Torn Apart By The Finest Tools Put Back Together Like A Menstrual Soup You Are So Beautiful Lit Disgust To My Eyes At Dusk Your Are So Pitiful Your Face Tainted And Deformed Eyelids Scrutinize In This Portrait Of Idolatry And Rot Her Body So Fragile Now Broken By My Hands I Am Retouching In A Tell-Tale Of Drama Caught ",3.1,0.0
