artist,song,lyrics,complexity,swear_words_ratio
obscura,sermon of the seven suns,"The Sermon of the Seven Suns A funeral of worlds Enshrouded, devoured, consumed in solitude Forsaken, abandoned, decayed in eternity A manifest in birth and death For each moment in time Light bringer, deceiver, cancer of the universe At ﬁrst enthrallment, a stream of grace Kingdom come - Evaporation Eternal enslavement, a touch of salvation Demise, disillusion, cremation Perdition, damnation, serpentine afﬂiction Sustained, unbroken, beyond redemption A manifest in birth and death For each moment in time A second emergent, a glint of bliss Kingdom come - Annihilation Scattered radiation, a kiss of death Vitiation, elimination, evisceration A virgin planet, blazed in ﬁre By a mass of ﬂame, the ultimate fate A spark of life, vanished in naught In a grand inferno, a funeral of worlds After hundreds of thousands of years A seventh sun reborn in agony A destroyer constrained in pitch black sorrow Breathless silence, a new born empty shell Light bringer, deceiver, cancer of the universe Perdition, damnation, serpentine afﬂiction Sustained, unbroken, beyond redemption A manifest in birth and death For each moment in time A virgin planet, blazed in ﬁre By a mass of ﬂame, the ultimate fate A spark of life, vanished in naught In a grand inferno, a funeral of worlds After hundreds of thousands of years A seventh sun reborn in agony A destroyer constrained in pitch black sorrow Breathless silence, a new born empty shell A new born empty shell Light bringer, deceiver, cancer of the universe A manifest in birth and death For each moment in time ",7.2,0.018604651162790697
obscura,weltseele,"As I walk through time and space Nourished from this holy feasts I tear through cosmic sea Obtain a universes farewell kiss Levitated in unmeasured far A blissful dream illuminated Captured in this bright sparkling glitter dome An enlightened shimmering black chamber Levitating grand massive comets Into here and then ascend to rise A maze built by suns and planets within To cut through evanescent infinite gravity Their presence, spirited, edged and alive A momentum in allegiance, devotion and pride As I reach for stars and unformed ground I shoot for the moon in eventide unbound Their presence, spirited, edged and alive A momentum in allegiance, devotion and pride Evermore supernal emboldened Transcend sincere desire From fluid to form, and liquid to life In barren earth moribund Suppressed in dreadful contestation In smoldering, rotten sympathy Blazed in vast pervade paradise In surplus, stained resplendence Broaden, unbundles pursuit of life In blessed observance combined Conceive, subsist in gratitude From each universe echoed Weltseele - A magnitude diaspora ",3.1,0.019230769230769232
obscura,ode to the sun,"What sudden blaze of majesty Is that which we from hence descry To whom our vows and wishes bend Here our solemn search has end Mother of a hundred gods Divine creation give her odds Who had thought this clime had held A deity, numinous and unparalleled This this is she - Sitting like a Goddess bright This this is she - In the center of her light Mark what radiant state she spreads In circle round her shining throne Scatter radiance like silver shreds This this is she To the celestial sirens harmony And turn the adamantine spindle round On which the fate of gods and men is wound This this is she Fame that her high worth to raise Once seemed so lavish and profuse We may justly now accuse Of detraction from her praise ",15.0,0.020689655172413796
obscura,ten sepiroth,"A crown, created with divine will An inﬁnite light of the creator Through wisdom, from nothingness, a ﬁrst revelation An unbound ﬂash widespread, sheer cataclysm A vessel, made of comprehension To give it grasp, of breadth and depth Ten Sepiroth - A central state of unity Ten Sepiroth - Emanations pure creation Upholding the heavens, saturating the stars In splendor bright glory, deliverance ascends Sustaining the cosmos, a maelstrom of spirits In newborn distress, emblazed sparkling spheres Loving grace of inspiring vision Withhold this victory in mere sincerity To envision the concentric circles Conscious alone the heretic Through wisdom, from nothingness, a ﬁrst revelation An unbound ﬂash widespread, sheer cataclysm Ten Sepiroth - A central state of unity Ten Sepiroth - Emanations pure creation ",7.2,0.0
meshuggah,clockworks,"Dismantling the clockwork that makes me the cynic Pallet, wheel and click The properties of mg indifference Reverse-engineering what makes it tick Dissecting the finetuned mechanism Rack and barrel, spring and pin Its synchronous characteristics To kill what makes it spin Disassemble this machinery Re-program these eyes, undo this design Labelled and filed, each part indexed Broken to pieces then thoroughly burned Deconstruction of what I am Buried to make sure he never returns Taken apart, defused, blueprints turned to ashes Eradicate the last remains, remnants of the insane Disintegration, the destruction of me now imperative To purge myself of this condition, complete this dissolution a necessity Break this deceitful machine A lie, what once I was, obsolete instrument An outmoded contraption, a malfunctioning device That callous self now extinguished, that malignant self now disused That conceited invention to nothing now reduced Complete disintegration, the destruction of me now imperative To purge myself of this condition, complete this dissolution a necessity Break this deceitful machine ",8.8,0.0064516129032258064
meshuggah,do not look down,"Strive, strive, surmount the obstacles Become the essence of your goals, hereditary dream Pray that you may attain that destiny Fall into the coveted line, Where life is but a theme of pretense in lustrous guise Claims and values, charts of means and status Plaques to show your strife Do your neighbor clones approve? Picture perfect illustration, imitation of life Where the path is evened out, all obstructions removed Great, viable citizen Are you happy now? Then praise your god and bow Shimmering surface The gleam of blinding lies Become the product The thing you so desire To what length would you go to reach your goals? What mantra will you use to justify your means? Who will you betray to secure your dream? What sins will you commit to avoid your sins to be seen? Do not look down Do not look down Or the abysmal beast of nonconformity might stare some unpleasant truth into your desensitized mind Shimmering surface The gleam of blinding lies Become the product The thing you so desire ",7.2,0.0
meshuggah,stengah,"Lacerating pains of degeneration speed through your trembling mind Still, in machine-like strife you gain another mile The temporary elusive goal: To reach the solace, to feed once more upon the synthetic reaper of loss. No matter the outcome, the cost Cold and stinging needs tearing through the halls Of your defiled, flesh made temple with its closing walls Still you claim the worshipers pose and you bow. You kneel Control: once superior, now a docile pet at chaos's feet Pulling the leash as it trails the scent to where all hurt recedes Your past a blurry patch in mind, your future once; now thin dreams filed Toward the lights of need you strive - to drink into your vein the shine Beaten to the unforgiving ground. Lashed into submission by the inner starving demon, by its unrelenting hand Still you claim the worshipers pose and you bow. You kneel to the syringe Answering only to authorities of sedation. Their calls the only ones heeded A worn out soldier touched by their contagion. A battered drone at their feet You're the one betrayed. An outcast set afire by your inner war Your burning self so far astray. A combustion fanned from within your core ",3.1,0.0099009900990099
meshuggah,spasm,"Stroboscopic contortion-assault. Light bulb language translated into fits Codes of tendon-flickers I can't grasp. Focus lost as I writhe and twitch Random beats of blinding shockwaves. Erratic suns that twist my eyes Flashes pounding at my thoughts as the intrinsic pains multiply Muscle and tissue twined with every violent lash Battered by an unrelenting shine Immobilized by the increasing pains, the procreating agonies of system breakdown Lightwave frequency body-oscillation. Undeciphered motions pass through my flesh Bodily reverberation induced. A corporeal system lost in its waves Bleached into their existence by tremulous epileptic strokes Blasts of irregular pulsar-radiation - Triggering the process of mind and body control Lost to their control A sentence - in flashes told Enticed by their calls; - Insane, divine Torn, undone, dissolved By incandescent gods condemned Burned. Their mark on my soul To my inverted shadow confined Twisted, spun. Vertebras and spinal column unaligned Joints shattered and torn apart. Spasm-rendered distortion Organic spiral. Stretched and torn into a new creation A worldless thing, a thingless word. Lightborn malformation ",6.4,0.01183431952662722
meshuggah,transfixion,trapped in a gaze where time stand still connected to a blur sensations deformed we are to drown just to become another set of eyes among the millions enchanted we fade selecting illusions dwellers of the scene a new world obsessed gods of displays divine screens radiate us now your blessing down kneel to shields of glass to the sovereign bleed for the entity of wavelenghts transfixed yet eyes glowing with delight delusions of omniscience bred us by liars mentally drained by the growing leech fed on our manic desire oceans of sewage continual washing into our minds drowning in wasted integrity with eyes too open to see vanity engulfed in super fiction fields what are we when the false pictures dissolve caged within a twilight world devoid of own self made thoughts stare blind ... ,5.7,0.012658227848101266
meshuggah,terminal illusions,i don't need religion god bless no one me and my own opinions are written by me you surrender under mass hypnosis bound to illusions produced by your god who is humane real alive no god i see your blindness erase your identity your mind is hollow carved to inability i know to be loyal to myself my integrity leaves myself alone in peace with me god there's no god life is a trap unlock your mind trust in yourself wake from the grip of the tongue you've been choked oppressed god owns god cheats god lies god hates god kills god slays the pressure on humanity has risen beyond control we are leading evolution into termination the sense of hate inbreeding scars to innocence genetic prejudice a selfdestructive line in pain why this reality life poured into inanity ,6.0,0.0
meshuggah,straws pulled at random,"What solace lies in the arms of fate -The ill embrace of uncertainty When did I leave this in other hands -To be pulled down at chance Ripped away by destiny-claws Am I another of fate's possessions Dwelling the lie of freedom Just another straw pulled at random Reclaimed by deceiving time A silent judgment I can not overrule Drawn back into the origin-vortex Uprooted and ground to dust Retracted into anti-existence A magnet repelled by life's polarity Denied the self control of fate we flow suspended in semi-life Until the ever imminent day when oblivion claims our breath Nowhere indefinitely. Not dead, not alive Existence-patterns ripped of symmetry. As will and fate divide Have I appeased the gods of fate Am I allowed another day Must I die to escape the scanning eyes of death ",5.5,0.0
meshuggah,nostrum,"Jealous vengeful fabrication Halo-crowned invention Sacred universal lie Artificial, divine Great archaic obseletum A prevarication, deceitfully contrived Synthesized, fictitious Dreamed up by remote prototypes Opiate for the yearning mass Administered, applied Three letter word for monster Empty promises of healing Profit aptly buried in the lies An industry rapt with avarice Medicatiing blind it's acolytes Useless panacea Imaginary cure-all To you we cry and supplicate Into your hell we fall Blind belief in their eyes Forever atoning Credulousy waiting Gazing to the skies ",7.6,0.0213903743315508
meshuggah,gods of rapture,I feel torn apart a vile misfit fallen Deep into affliction of my hollow mind The sense of suffocation grows inside my lungs When i wake into truth I'm back among the blind The truth of lies disenchanting my eyes How can I survive I can't stand being Alive... alive... Gods of rapture enshrouding my eyes I try to hide Then slowly I die My past laugh at me from the other side of negation Untying the lasting few cords of common sense Submerged into the flow the rapids of addiction Too weak to push it back a worm without defence My flesh fading undressing the bones behold me naked Cadaver exposed this my abuse I can't take it no more The fragile truth sneering at me with teeth pressed Like thrusting nails into my head all my life I regret ,15.0,0.020689655172413796
meshuggah,cadaverous mastication,"Here we are to stay We all can see the purblind day Assail the cause Defray the ogre, the insubordinates Restrained to live Bring me home Confronting mutants We are all bound to fall Mortality we see today, defrauds our dreams Approachable to die Sliced by their lies, secured morbidity Restrained to live Bring me home Confronting mutants We are bound to fall How many of the judges place a bet on me? What's there to be? MORIBUND IRREVERENCE What's there for us in this deranged society? Inanity CADAVEROUS MASTICATION SATURDAY They have saturday SATURDAY Now it's saturday SATURDAY They have saturday SATURDAY Now it's saturday YOU ARE INSANE How can you let there be such cruelty YOU ARE INSANE Now it's time for you to see Here we are to stay We all can see the purblind day Assail the cause Defray the ogre, the insubordinates Restrained to live Bring me home Confronting mutants We are bound to fall We are bound to fall ",6.9,0.0189873417721519
meshuggah,dont speak,,3.1,0.04
meshuggah,pravus,"Drooling floods of lead Armed with distorted belief Sharp munition spat from our minds Malignancy-rounds, automatic fire Black, acidic bile Seeping wounds of shattered souls Still not pissing out fast enough To quench our thirst for it to bleed us dry Vile, ever-menacing intent Repulsive belligerence shot from toxic minds Blatant disregard for all but self Proudly flaunting the depravity of a race condemned, malign Iterate, repeat these my words Recite the mantra of late: I will corrupt and impair vitiate, dispirit, debase, violate Souls born with hateful intent The deceitful spawn, descendants of lies By the poisoned nails of history stung If granted the will to injure If granted the will to harm - the blades of hurt inexhaustibly swung ",8.8,0.004545454545454545
meshuggah,obzen,"A state of perfection, immersed in filth Equilibrium obtained Pure in devotion to all things unwell This sweet Zen of our ill condition sustained A new belief-system Salvation found in vomit and blood Where depravation, lies Corruption, war and pain is God Balance Harmony found in the sickly, the vile Unflinching eyes, joyous and gleaming Intense in their need to watch things die A new belief-system Salvation found in vomit and blood Where depravation, lies Corruption, war and pain is God Decay, disgrace, disgust Our state of Zen The grime of contempt and degeneration Sticky, foul and pungent The sediment of our creation We flourish in this bloodred soil ",16.2,0.025735294117647058
meshuggah,by the ton,"To you a beast you think you comprehend Not necessarily made all evil In the reflective pool of your eyes I see fear and intrigue co-mingle You hesitate to deem me all bad Yet when my face is shown, your eyes avert New thoughts sprout from that fearfilled soil Your nerves and intuition back on full alert You think that you've seen the truth, you think you know Yet disbelief grinds, the doubt it claws In you sleepless delirium I devour your thoughts If you only knew how your way of life sustains me Like electricity coursing through my soul Your will to retaliate, your vengeful thoughts announced I bring you me - conflict and death And the promise of spilling red by the ton I just might be there in your final moment I just might be the last thing your eyes take in ",10.5,0.012048192771084338
meshuggah,vanished,Convalescent livid we succumb Stagnation now complete This is the new plague called Unconsciousness We're selfcaged in defeat Clotted minds coagulate we are trapped Inside the tears we obey resignate to our Self-inflected fears Voices calm will be never heard In this mode who will change Bantised in our minds so absurd Is this the world sublime Into pools of paranoia we're fading with Reality drained by lies we are al inhuman Introspective vanishing Sterile thoughts now upraised in subhuman Majesty bodies numb still enchained Where am I in hell of our dreams Wrong wrong I'm in the now the vain reality So it seems we're dying yet content Worship our chrysalis stage since when are Lies devine Since when This is now degrade indulge This is us servile obliging Swallowed by our hunger for mendacity As this dance whirls deeper into hate We're vanishing In down deep cold where am I caught cage Trapped not in dreams now time has killed Our eyes fall fade gone dead away ,5.4,0.008264462809917356
meshuggah,the mouth licking what youve bled,"I'm The Shallow, The Superficial. I'm The Common Man. Faithless, Narrow Minded, Indifferent, Impassive. A Sycophantic Leech. Tantamount To Disintegrity. I'm The Vulture Feeding On Malignancy. I'm The Sin, The Lecherous Sneering At Prostration. I Wallow In Disease. I Rejoice At Degradation. I Yawn At Misery. Spit At Others Happiness. An Advocate Of Manipulation. I Embrace The Sickening. I'm The Lost. I'm Average. I'm Common. I'm Infection. I'm Human. I'm Common A Worm Thriving In Seas Of Disgust. I'm Common. The Mouth Licking What You've Bled. I'm Common I'm The Pampered Degenerate. I Indulge My Inclinations The Only Words To My Attention Are Those That I My Self Create Disorder. Chaos. I Debar All Order, Repudiate All Purity. Infatuated By Contentment. I Laugh At Lies. Come Behold The Sickness In My Common Human Eyes. I'm The Greed. The Cynic. I'm The Indifferent Gaze. Mendacity, Betrayal; This Is Not A Phase Ebullient With Human Filth, Here I Am. Here I Stay. Flourishing In Our Disgrace. Blessed Be The Human Way ",7.2,0.0
meshuggah,suffer in truth,tortured soul ripping skin into ashes blind by pain deaf by lies smell of freedom violently cuts forgiveness power to a being never dies suffer in truth's narrow passage saw weak solutions stabbed to now know the smile of obliterations face penetrating through the void of life a dance with the dead buried in oblivion stolen from the mind constant starving never fed contamined life is fading laughing in my face suffer in deception manipulated not to feel slain beleifs abandoned dreams a life of misery suffer in truth the wounds of a soul in pain a mirror of life dreams all in vain life will always be sealed i see ... unseen i feel ... unseen suffer in truth ,11.2,0.00684931506849315
death,empty words,"Ashes and promises share a bond Through the winds of change Words are blown away When visions that should be Are tattooed in your mind The power to let go Is sometimes hard to find The answer cannot be found In the writing of others Or the words of a trained mind In a precious world of memories We find ourselves confined Claws so razor sharp Ripping at the spirit Promises a potential to hurt Is anything real? When forever is to be until Deep inside, in the world of empty words... No escaping from those haunting Empty words... Do you ever feel it? A craving that is so strong To by thought rewind in order to find Expectations that shined through the doubt That soon would turn into the price Of what a word will be worth When tomorrow comes To be and we are left Standing on our own And seeing what is real... The answer cannot be found In the writing of others Or the words of a trained mind In a precious world of memories We find ourselves confined Claws so razor sharp Ripping at the spirit Promises a potential to hurt Is anything real? When forever is to be until Deep inside, in the world of empty words... No escaping from those haunting Empty words ",4.8,0.005
death,politicians in my eyes,"1, 2, 3 Now! The number one biggest game It's when they gain the most fame, it's like a race to the top because they wanna be boss They don't care who they step on as long as they get along Politicians in my eyes! They could care less about you They could care less about me As long as they are at the end of the place they want to be They're always wearing? styles, they like the clothes with those stlyes Politicians in my eyes! Always tryin to be slick when they tell us the lies They're responsible for sending young men to die We have waited so long for someone to come along and correct our country's law, but the waits been too long Sure they think they can?, but when they lie on debate They keep the? at bay I met a man named Jose, but when they? his?, that's when they have all their fun Politicians in my eyes! They're always tryin to confess, just like we don't have no sense They're just as likely to?, but they don't do stupid things They'll tell you truth up and down, because you're never?? Politicians in my eyes! Reaching out, shaking hands Making friends and other plans Some will rise, some will fall Some won't even answer calls Lookie here, see them fight, see the twinkle in their eye Politicians tell me why, can't you hear the people Cry? Yeaaaaaaaah araaaaaagh! ",8.8,0.010204081632653059
death,spiritual healing,"Always blocking the doors to your mind Escaping reality that surrounds you Using faith an excuse to kill A sick way of life is now revealed All the prayers in the world can't help you now A killer a taker of life is what you are Speak no more lies It's your turn to die Preach the good word Speak no more, prepare to burn A justified torture? From this may others learn The life you took a holy death, a grave mistake No changing your mind, your life you should pay Practice what you preach Your loved one is now deceased Knowledge is at our hands Never to understand Spiritual healing Blinded by twisted ways you live Kill for religion, will the Lord forgive? Idiocy has stricken your mind A real-life hell you will find All the prayers in the world can't help you now A killer a taker of life is what you are Speak no more lies It's your turn to die Preach the good word Speak no more, prepare to burn A justified torture? From this may others learn The life you took a holy death, a grave mistake No changing your mind, your life you should pay ",7.3,0.0576923076923077
death,killing spree,To the world around he was the perfect person Planning for an alibi he then starts rehearsing A human bomb just waiting to explode This secret rage can't be controlled Slaughtered the dreams of others On left to recover Self-inflicted wounds Life he has comsumed Planning a killing spree Victim of a conspiracy? Getting bored with his current life Rearranging with a knife Greed before despair suspicion starts to grow His life was spared for this he does not know Screams filled the air there was no way to help The ones he mourns he killed himself Slaughtered the dreams of others On left to recover Self-inflicted wounds Life he has comsumed Planning a killing spree Victim of a conspiracy? ,7.6,0.014388489208633094
death,sacrificial,With chainsaw in hand Your death I demand Slicing through your fat My awaited gore attack Manipulating lies Is your way of life Riding on cheap glory Your life is getting gory Watch you bleed to death Gasping for last breath Choking on your blood I shit onto your guts Sacrificial cunt I despise Sacrificial cunt No more lies Slabs of fat Lay on the ground Ram an axe Into your mound Time to pay the gruesome price A stupid cunt we sacrifice Watch you bleed to death Gasping for last breath Choking on your blood I shit onto your guts Sacrificial cunt I despise Sacrificial cunt No more lies Sacrificial cunt I despise Sacrificial cunt No more lies ,6.4,0.005847953216374269
death,see through dreams,Born into darkness Where sounds portay the images that are out Out of reach from my sight Which has been denied Hands change into my eyes Body senses intensified Sight so close yet far away In dreams my thoughts take their form To give memories identity Through dreams I obtain The ability to connect sight with sound Close your eyes and imagine to be without What we take for granted every time we open eyes A permanent shadow to never step away Feel the dark in the cold Feel the warmth of the light Which has been denied Hands change into my eyes Body senses intensified Sight so close yet far away In dreams my thoughts take their form To give memories identity Through dreams I obtain The ability to connect sight with sound ,6.4,0.025974025974025976
death,jealousy,,8.1,0.026086956521739132
death,sacred serenity,"Wherever we go, whatever we do Your shadow is not far behind our steps And our breath Protecting and watching all... Observing spirits on the wall What are they telling you? Following all instincts that are pure Oblivious to time that may be the cure Sacred is the gift That they have without knowing Serenity is knowing it's safe From destruction of time Maybe we could take a step back And discover what leads us to attack Time that is short - distance unknown For them, each day life has just begun Observing spirits on the wall What are they telling you? Following all instincts that are pure Oblivious to time that may be the cure ",8.0,0.05
